{
  "civilian_text": "You feel like taking a shower",
  "killer_text": "You could fake taking a shower",
  "mood_value": 1.0,
  "weight": 1,
  "repeatable": true,
  "condition": {
    "type": "mood_swings:under_block",
    "block_tag": "mood_swings:shower_heads",
    "duration_seconds": 10,
    "scan_height": 8,
    "require_powered": true,
    "required_facing": "down"
  }
}
