{
  "$schema": "./task-definition.schema.json",
  "civilian_text": "You feel like doing something",
  "killer_text": "You could fake doing something",
  "mood_value": 1.0,
  "weight": 1.0,
  "repeatable": true,
  "audience": "all",
  "blocks_passive_income": false,
  "condition": {
    "type": "mood_swings:stay_in_area",
    "area": "example_area",
    "duration_seconds": 10
  }
}
