{
  "civilian_text": "You feel the urge to use the toilet",
  "killer_text": "You could fake using the toilet",
  "mood_value": 1.0,
  "weight": 1.0,
  "repeatable": true,
  "audience": "all",
  "blocks_passive_income": false,
  "condition": {
    "type": "mood_swings:above_block",
    "block_tag": "mood_swings:toilets",
    "duration_seconds": 10,
    "scan_depth": 1
  }
}
